NUM,name,address,type,lat,lon,id,label
4540,武汉市江岸区运输六公司,香港路248,公司,30.61015276,114.275554,38927,7
4541,江岸区数码港瑞胜科技有限公司,湖北省武汉市江岸区中山大道707附7附近,公司,30.58979906,114.2902111,38929,7
4542,武汉市江岸区土产日杂公司,花莲里22号附近,公司,30.60408069,114.2791542,38930,7
4543,江岸区吉祥大厦堂大药房有限责任公司,湖北省武汉市江岸区吉庆街155号附近,公司,30.58958284,114.2880747,38931,7
4544,武汉江岸区三眼桥路停车场,湖北省武汉市江汉区三眼桥路150号附近,停车场,30.61294266,114.2762888,38932,5
4545,江岸区排水管理站-停车场,武汉市江岸区联合村,停车场,30.59523281,114.2843036,38933,5
4546,江岸区江岸科技创业中心德信息科技有限公司,湖北省武汉市江岸区石桥一路6西南50米,公司,30.62815376,114.2712829,38934,7
4547,江岸区丹水蔬菜食品百货有限责任公司,湖北省武汉市江岸区丹水池金鑫宾馆(武汉丹水池店),公司,30.6466434,114.3258247,38935,7
4548,武汉市江岸区乾鼎小额货有限公司,湖北省武汉市江汉区建设大道562号国贸新都A座19A-G,公司,30.59666736,114.2640163,38936,7
4549,武汉市江岸区好学盛华文化教育培训学校有限公司,湖北省武汉市江岸区香港路157号附近,公司,30.60464319,114.2813106,38938,7
4550,江岸区高新技术创业中心中环大厦科技企业孵化器,云林街31号,公司,30.59806224,114.2714253,38939,7
4551,武汉市江岸区寓知乐学校有限公司文化教育培训,惠济一路与黄孝河路交叉口东50米,公司,30.61582822,114.2811074,38940,7
4552,中建三局水务公司,湖北省武汉市江岸区四唯街街道解放大道1208号新长江国际大厦a座24楼,公司,30.6030891,114.295389,38942,7
4553,水务综合大楼-停车场,武汉市江岸区六合路28号,停车场,30.6040427,114.3017676,38943,5
4554,道达尔后湖大道交通加油站,塔子湖街街道后湖大道89号(全民健身体育中心对面),加油站,30.6430911,114.2811427,38956,6
4555,中国石油加油站(和谐大道397号),湖北省武汉市江岸区塔子湖东路,加油站,30.64725587,114.2720464,38958,6
4556,中国石油(远洋庄园加油站),湖北省武汉市江夏区庙山开发区阳光大道圣宝龙工业园二期村,加油站,30.40520265,114.3603429,38960,6
4557,中国石油(新马加油站),解放大道2721号,加油站,30.65678824,114.3289535,38961,6
4558,中国石油(汉黄路加油站),汉黄路8号,加油站,30.66552747,114.326112,38962,6
4559,中国石油,武汉市洪山区白沙洲大道凌吴敦万科金色城市旁武金堤边593公交车终点站,加油站,30.48529221,114.2588683,38966,6
4560,中国石油(柏银路加油站),柏银路62号,加油站,30.68734362,114.1685685,38967,6
4561,中国石油四新北路加油站,湖北省武汉市汉阳区杨泗港快速通道,加油站,30.53901516,114.1963173,38968,6
4562,中国石油加油站(龙阳湖东路),康达街与龙阳湖东路交叉口西北50米,加油站,30.54827659,114.1859392,38969,6
4563,中国石油(黄金加油站),湖北省武汉市江夏区郑店街黄金村53号,加油站,30.36880306,114.2534531,38970,6
4564,中国石油(兴邦华庭西北),武昌大道8号,加油站,30.37468514,114.3074626,38971,6
4565,中国石油(煤建加油站),武汉市汉南区汉南大道140号,加油站,30.30502734,114.0741476,38973,6
4566,中国石油(永兴街),高速公路永安收费站出口处左邻,加油站,30.46023157,113.9557485,38974,6
4567,中国石油(大东加油站),湖北省武汉市蔡甸区L山街大东村,加油站,30.45273126,114.0095263,38977,6
4568,中国石油(玉贤加油站),武汉市蔡甸区玉贤镇61号,加油站,30.50838147,113.9769282,38979,6
4569,中国石油(蝙蝠小学南),104省道(蝙蝠小学南),加油站,30.55350567,113.9913088,38980,6
4570,中国石油加油站(星光大道),星光大道北50米,加油站,30.40721644,114.2828323,38981,6
4571,中国石油集团济柴动力总厂武汉发动机厂,山湖路与邢远长街交汇处西北角,公司,30.39258693,114.2758808,38983,7
4572,中国石油化工股份有限公司,汽渡路352号附近,公司,30.6397963,114.5659866,38984,7
4573,北京奔驰南方整车物流基地,湖北省武汉市蔡甸区中国石油高庙加油站西(南环路北),公司,30.56052163,114.0234245,38985,7
4574,武汉市奥帅物资有限公司,湖北省武汉市江岸区谌家矶中国石油朱家河加油站北,公司,30.67793859,114.3598628,38986,7
4575,昆仑好客(谌家矶大道店),湖北省武汉市江岸区先锋谌家矶大道中国石油朱家河加油站,公司,30.67683283,114.360082,38987,7
4576,华润鲜点(哈斗专卖店),中山大道769附3号,休闲餐饮,30.59218234,114.292024,38996,2
4577,华润湖北金马医药公司,武汉市江岸区洞庭街139号,公司,30.59413728,114.2984528,38997,7
4578,中国海油,汉口青年路招银大厦16层,公司,30.59623853,114.2583154,38998,7
4579,中国石化润滑油公司(武汉分公司),江岸路11号,公司,30.65694277,114.341853,38999,7
4580,中国石化加油站(湖北武汉谌家矶站),武汉市江岸区谌家矶大道89号,加油站,30.68085206,114.3688703,39000,6
4581,中国石化加油站(湖北武汉平安北中环站),武汉市三环线解放大道2021号,加油站,30.69597699,114.3701223,39001,6
4582,中国石化加油站(湖北武汉平安南中环站),武汉市三环线服务区内,加油站,30.6955011,114.3684237,39002,6
4583,中国石化服务公司,湖北省武汉市江岸区新南路汉口江滩三期附近,加油站,30.65721988,114.3400842,39004,6
4584,中国石化服务公司,湖北省武汉市江岸区新南路汉口江滩三期附近,公司,30.65715301,114.3400519,39005,7
4585,中国石化洪环加油站,森林大道3号,加油站,30.51057715,114.468642,39006,6
4586,中国石化(许桥加油站),甘棠岔马路许桥村,加油站,30.89526785,114.5450653,39009,6
4587,中国石化长城润滑油武汉分公司储运中心,湖北省武汉市江岸区金桥大道58号西80米,公司,30.64755165,114.287814,39010,7
4588,中国石化长江燃料有限公司武汉分公司,武汉市江岸区二七街办事处工农兵路一号军供宾馆内六号楼,公司,30.62052969,114.2987609,39011,7
4589,中国石化武泰闸加油站,陆家街295号,加油站,30.51943454,114.2952932,39013,6
4590,聚龙大厦-地下停车场,湖北省武汉市江岸区二七中国石化加油站(航天双城南),停车场,30.62324654,114.3098191,39016,5
4591,易捷,湖北省武汉市江岸区解放大道2023号附近,公司,30.6226984,114.3096034,39018,7
4592,易捷便利店,湖北省武汉市江岸区沿江大道250附近,公司,30.61476791,114.3113288,39019,7
4593,EASY JOY便利店,湖北省武汉市江岸区解放大道2023号附近,公司,30.62299123,114.3097563,39021,7
4594,安强石油设备,湖北省武汉市江岸区谌家矶大道28附6号,公司,30.67588727,114.3606991,39022,7
4595,武汉金昌石油化工公司,武汉市江岸区谌家矶大道56号,公司,30.68150751,114.3720113,39023,7
4596,江夏石油加油站,江夏区大花岭街和文化大道丁字路口南侧路西,加油站,30.41226055,114.3133792,39026,6
4597,民族大道加油站,民族大道307号,加油站,30.47488155,114.3885768,39027,6
4598,武汉公交加油站,解放大道2080号,加油站,30.66617384,114.3414543,39028,6
4599,中国石油加油站,武汉市新洲区109省道东50米,加油站,30.72760605,114.5925188,39029,6
4600,联群加油站,湖北省武汉市黄陂区祁泡线李桥村还建小区西北200米,加油站,30.86789074,114.2275229,39031,6
4601,岔马路加油站,湖北省武汉市黄陂区岔马路五毛电器北70米(熊许路西),加油站,30.88961829,114.5417403,39035,6
4602,天海石油加油站,经济开发区大桥新区办事处大桥村,加油站,30.37466099,114.2963429,39036,6
4603,升官渡加油站,沌阳街升官渡,加油站,30.53822269,114.1881611,39037,6
4604,金能加油站,新道公路北50米,加油站,30.87488471,114.9391974,39038,6
4605,公路局加油站,纸坊街关山桥,加油站,30.33716924,114.2959762,39039,6
4606,加油站(窑咀),101省道附近,加油站,30.38722845,114.1012151,39040,6
4607,加油站(二大队),111省道与平江大道交叉口、武汉工业技术学院附近,加油站,30.71069228,114.5388723,39041,6
4608,旧街石化加油站,康阳街,加油站,30.83566765,114.9062967,39043,6
4609,四道沟加油站,"034乡道与065乡道交叉口,武汉市曹家湖村附近",加油站,30.74427692,114.7731334,39044,6
4610,正豪加油站,武汉市潘塘路与紫荆路交叉口南150米,加油站,30.99400337,114.8901546,39045,6
4611,宇成石化加油站,纸金路19号,加油站,30.33506439,114.2741376,39046,6
4612,加油站(新李路),新李路南50米,加油站,30.84957408,114.7611729,39047,6
4613,金家嘴加油站,焦沙公路与二十一号公路交叉口东北向(建设中心小学附近),加油站,30.64363848,114.4548076,39048,6
4614,三强塑料制品有限责任公司,谌家矶街办事处平安铺村特2号,公司,30.69348304,114.3822783,39049,7
4615,香港金利塑料制品有限公司,湖北省武汉市江岸区武汉铁路黄埔住宅小区南50米,公司,30.63266035,114.3090332,39051,7
4616,进圆门塑料厂,湖北省武汉市江岸区江汉二路150号进圆门塑料厂,公司,30.5873303,114.286897,39052,7
4617,梅梅塑料,香港路球场巷7号11号,公司,30.59747605,114.2864545,39053,7
4618,铂利塑料机械制造有限公司,湖北省武汉市江岸区丹水池强大实业工业园武汉鑫铂利塑料机械制造有限公司,公司,30.65464049,114.3362743,39055,7
4619,河北亚大汽车塑料制品有限公司武汉分公司,湖北省武汉市蔡甸区枫树南路67号,公司,30.4531269,114.1128036,39057,7
4620,台塑集团南亚塑胶,湖北省武汉市江汉区红旗渠路53号,公司,30.62354305,114.2406924,39061,7
4621,湖北帅伦实业集团有限公司,湖北省武汉市江岸区孙家岗谌家矶大道北500米,公司,30.67112958,114.3455335,39063,7
4622,竹叶山集团有限公司,湖北省武汉市江岸区后湖街办事处和谐大道特一号,公司,30.66369415,114.3018168,39065,7
4623,武汉中化塑胶制品有限公司,湖北省武汉市江岸区健美街30号立城中心商务楼9f武汉中化塑胶制品有限公司,公司,30.6541488,114.2821936,39066,7
4624,高凯塑胶,湖北省武汉市江岸区不锈钢路,公司,30.66732795,114.299738,39067,7
4625,康泰塑胶科技集团有限公司,香港路华氏儒商花园F座2008室,公司,30.6090474,114.2781873,39068,7
4626,常盛源塑胶有限公司,武汉市江岸区二七街办事处二七路224号A-10,公司,30.63016389,114.3074065,39069,7
4627,武汉市鑫铂利塑料机械制造有限公司,武汉市江岸区丹水池黄合村251号强大实业工业园6号,公司,30.65513648,114.3358615,39072,7
4628,宁波东科塑胶有限公司武汉分公司,湖北省武汉市江岸区解放大道天姿美容美发化妆学校附近,公司,30.64766906,114.3290992,39073,7
4629,钣金注塑分厂,湖北省武汉市蔡甸区经济技术开发区珠山湖大道枫树四路美的工业园,公司,30.45847831,114.1140205,39075,7
4630,绿地美园林工程公司,湖北省武汉市江岸区堤边路,公司,30.66766497,114.340894,39082,7
4631,绿地中国华中公司,湖北省武汉市江岸区中山大道1628号武汉天地企业中心a528层8号绿地中国华中公司,公司,30.6119249,114.3054935,39084,7
4632,湖北益生天济大药房连锁有限公司,武汉市武昌区和平大道绿地国际金融城绿地蓝海A座25楼,公司,30.58502624,114.3193427,39092,7
4633,武汉市水务集团公司汉口供水部维修工程处,长湖地一村22,公司,30.63520231,114.3159862,39142,7
4634,中国水务集团(武汉代表处),武汉市江岸区建设大道692号,公司,30.60429007,114.2766696,39144,7
4635,湖北省电力博物馆-停车场,湖北省武汉市江岸区合作路22号附近,停车场,30.58756914,114.293204,39147,5
4636,犄角旮旯(球场路总店),武汉市江岸区球场路43,中餐,30.6003669,114.2881319,39148,1
4637,武汉市毅源电力建设有限公司,湖北省武汉市江岸区三阳路新长江国际A座1505室,公司,30.60327187,114.2952675,39149,7
4638,慕臣便利店(球场街店),武汉市江岸区劳动街办事处解放大道1703号,公司,30.59953334,114.2894323,39150,7
4639,绿色农场,湖北省武汉市江岸区新益街幸福时代三期16-1-14,公司,30.65893893,114.3084073,39152,7
4640,武汉耀隆园林绿化工程有限公司,湖北省武汉市江岸区汇悦天地7-1-902,公司,30.65750195,114.2787891,39153,7
4641,屈臣氏(江岸南国汉口城市广场店),湖北省武汉市江岸区后湖大道111号汉口城市广场购物中心1层,便利店,30.6545963,114.3022018,39155,4
4642,武汉江岸环卫集团有限公司直属三公司,湖北省武汉市江岸区解放大道中信仁和科技发展有限公司,公司,30.64187565,114.3230542,39156,7
4643,武汉江岸环卫集团有限公司汽车运输公司,湖北省武汉市江岸区机电园路,公司,30.67117298,114.3274886,39157,7
4644,江岸环卫集团有限公司公厕管理中心,幸福路百步亭花园路口南100米,公司,30.66250506,114.3168705,39158,7
4645,武汉江岸环卫集团有限公司清扫一公司,台北街办事处台北路台北二村和美社区院内76号,公司,30.59975601,114.2735089,39160,7
4646,武汉岸八清环卫有限公司,新湖街155号,公司,30.65724568,114.3337039,39161,7
4647,武汉市淌湖环卫保洁有限公司,武汉市江岸区正义路南150米,公司,30.63568876,114.2944983,39162,7
4648,江夏区环境卫生服务有限公司,武汉市江夏区谭鑫培路,公司,30.37065939,114.3259858,39163,7
4649,黄陂区长轩岭街环境卫生保洁公司,湖北省武汉市黄陂区新建街120附近,公司,31.09820135,114.3463208,39164,7
4650,中央防汛抗旱物资武汉仓库,湖北省武汉市江岸区堤角前街18号,公司,30.66250918,114.3394948,39178,7
4651,中国水文化杂志社,武汉市江岸区解放大道1863号,公司,30.61288375,114.3013933,39179,7
4652,长江工程监理咨询有限公司,武汉市江岸区解放大道1863号,公司,30.61273405,114.3011772,39180,7
4653,空间公司,湖北省武汉市江岸区劳动街街道解放大道1863号长江防汛科技大楼4号楼空间公司,公司,30.61404519,114.3014342,39181,7
4654,长江伟业集团,建设大道1097,公司,30.62878528,114.3011246,39194,7
4655,武汉环境投资开发集团,武汉市江岸区兴业路136号8楼,公司,30.63152317,114.2706791,39195,7
4656,武汉旅游发展投资集团,湖北省武汉市江岸区金桥大道,公司,30.65964488,114.2903797,39196,7
4657,武汉港务集团有限公司,湖北省武汉市江岸区沿江大道十八码头,公司,30.58108925,114.2928488,39199,7
4658,武汉公交集团第一营运公司(堤边路),丹水池街办事处江岸路12号,公司,30.66606757,114.3412132,39200,7
4659,新八建设集团有限公司,武汉市江岸区解放大道2111号新八大厦,公司,30.62376978,114.3099475,39201,7
4660,武汉碧水集团有限公司,大智街办事处沿江大道天津路口汉口江滩大楼四楼,公司,30.58425167,114.2952133,39202,7
4661,中国邮电器材集团武汉中邮普泰,张自忠路8号,公司,30.6065378,114.3048802,39203,7
4662,中国人民保险集团股份有限公司(江岸支公司),球场路30号,公司,30.60178208,114.2875592,39206,7
4663,左巴科技(武汉)有限公司,武汉市蔡甸区双峰村亚联管道厂旁,公司,30.45243579,113.9603177,39219,7
4664,通风管道,湖北省武汉市东西湖区三秀路119号附近,公司,30.61933275,114.1402901,39221,7
4665,建华市政管道,武汉市东西湖区舵落口大市场15区14栋207-208号,公司,30.61290693,114.146749,39223,7
4666,武汉开创宏交通设施有限公司,四台工业园金花路川林管道对面,公司,30.58149676,114.1546513,39229,7
4667,战友井盖管道,湖北省武汉市东西湖区新城十二路115号附近,公司,30.6229411,114.1004945,39231,7
4668,亿丰管道,湖北省武汉市东西湖区西一路,公司,30.61009232,114.1467201,39235,7
4669,武汉唯特奇管道有限公司,湖北省武汉市蔡甸区沌口经开区万达广场6号写字楼1802,公司,30.51092365,114.169189,39242,7
4670,武汉锦盛元管道配件有限公司,湖北省武汉市东西湖区新城十二路35号东60米,公司,30.62122867,114.1022812,39243,7
4671,武汉管道煤气公司,武汉市~口区古田二路与园博园南路交叉口西100米,公司,30.62478559,114.1959229,39244,7
4672,武汉市历品通管道配件有限公司,湖北省武汉市东西湖区三秀路附近,公司,30.61241052,114.1416068,39247,7
4673,武汉朋华市政管道,湖北省武汉市东西湖区西一路,公司,30.61009543,114.1467242,39251,7
4674,中塑市政管道,107国道力通达公司旁,公司,30.6193497,114.1159807,39253,7
4675,格云环保检测技术服务有限公司,东湖新技术开发区华师园北路11号格云环保检测技术服务有限公司,公司,30.46034169,114.3926415,39262,7
4676,中元牧康武汉检测技术服务有限公司,湖北省武汉市江夏区生物园东路与神墩二路交叉口西南100米,公司,30.48458553,114.5378498,39263,7
4677,湖北省宇星检测技术服务有限公司,湖北省武汉市江夏区佛祖岭四路葛洲坝太阳城22栋,公司,30.45815251,114.471254,39264,7
4678,湖北筷智聚力信息技术服务有限公司,湖北省武汉市洪山区黄龙山北路2栋5楼,公司,30.47436274,114.428596,39266,7
4679,宝中旅游(茶港营业部),湖北省武汉市武昌区湖北省地震局(武汉大学文理学部西),公司,30.54164056,114.3478499,39272,7
4680,中冶南方武汉建筑设计有限公司,武汉市徐东大街338号,公司,30.57758597,114.359375,39273,7
4681,长江工程项目管理有限公司,劳动街办事处永清路21号枫丹白鹭b座,公司,30.61230662,114.2979796,39274,7
4682,武汉海诚景观设计工程有限公司,首义路176,公司,30.53446246,114.3031433,39276,7
4683,武汉恒丽洁汽车技术推广有限公司(江摩分公司),百步亭花园百步亭路十大家东勤佳苑2栋1层,公司,30.66463876,114.3169489,39280,7
4684,武汉有线江岸分公司(百步亭工作站),武汉市江岸区安居路57号,公司,30.65092575,114.3148285,39295,7
4685,武汉义开电力工程公司,湖北省武汉市江岸区岱山街,公司,30.67201226,114.3149244,39299,7
4686,国网湖北省电力公司武汉供电公司,湖北省武汉市江岸区解放大道1053号附近,公司,30.59995451,114.2900235,39302,7
4687,武汉供电公司客户服务(汉口分中心),建设大道罗家庄136号,公司,30.62624865,114.2979585,39309,7
4688,武汉市天然气有限公司(世博园店),百步亭花园路世博园一号门旁,公司,30.65917327,114.3095739,39311,7
4689,武汉天然气有限公司,解放大道劳动街葡京花园44栋,公司,30.60330566,114.2934425,39320,7
4690,武汉市友邦燃气具安装维修有限公司,湖北省武汉市江岸区罗家嘴路富士・君安花园(星悦城北),公司,30.64197677,114.2639802,39324,7
4691,上海燃气工程设计研究有限公司武汉分公司,汉黄路888号岱家山科技城10号楼8层,公司,30.66946791,114.3202512,39325,7
4692,天然气公司黄埔站,湖北省武汉市江岸区建设大道1067号北100米,公司,30.62104047,114.2908564,39327,7
4693,天然气公司江汉站,湖北省武汉市江岸区云林路56-82号附近,公司,30.59591205,114.2730338,39328,7
4694,湖北大秦伟光市政燃气工程有限公司,上海路19-1号声直大厦A座18A1-2,公司,30.58229784,114.2900146,39329,7
4695,武汉东川自来水科技开发有限公司,江汉二路181号亚洲证券大厦11楼A,公司,30.58889564,114.2884136,39330,7
4696,五里界供电营业所,湖北省武汉市江夏区五里界供电营业所(界兴路南),公司,30.33870334,114.4000685,39338,7
4697,武汉江夏区供电公司,纸坊大街522,公司,30.34586754,114.303769,39339,7
4698,东西湖供电公司(吴家山营业所),湖北省武汉市东西湖区吴祁街1号,公司,30.6275327,114.1328309,39340,7
4699,武汉供电公司检修公司武昌配电运检工区,和平大道246号积玉桥,公司,30.56374174,114.3036601,39342,7
4700,世纪超市(园丰供电小区东),花桥街办事处蔡家田北区园丰村344号,公司,30.62552322,114.2724035,39347,7
4701,山坡供电营业所,星明街74,公司,30.08872799,114.3508379,39350,7
4702,湖北武汉供电公司,文治街72号,公司,30.50274628,114.3336398,39353,7
4703,范湖供电营业厅,金康南路3,公司,30.29706002,114.1181921,39356,7
4704,蔡甸张湾供电营业厅,柏林街103,公司,30.58417802,113.9736588,39358,7
4705,康稳移动供电设备武汉有限公司,湖北省武汉市~口区丰硕路,公司,30.60527459,114.1853839,39359,7
4706,征原电气,湖北省武汉市江岸区石桥一路5号,公司,30.63114695,114.2771502,39360,7
4707,鑫辉旺配电公司,湖北省武汉市江岸区二七横路50号,公司,30.6344559,114.3142,39362,7
4708,岱嘉电气,武汉市江岸区二七街办事处黄浦大街86号黄埔东宫b座2505室,公司,30.61739739,114.3010993,39363,7
4709,湖北康威特液压机电有限公司,湖北省武汉市江岸区后湖大道111号湖北康威特液压机电有限公司,公司,30.65465018,114.3018126,39366,7
4710,武汉怡心供暖工程有限公司,解放公园路32号,公司,30.60650123,114.2947139,39372,7
4711,德胜供暖,湖北省武汉市江岸区解放大道1729附近,公司,30.6012625,114.2917166,39375,7
4712,德国菲斯曼供热技术,湖北省武汉市汉阳区红星美凯龙三楼C8089,公司,30.5358744,114.1912075,39378,7
4713,德国菲斯曼供热技术(居然之家),武汉市武昌区徐东大街50号居然之家F2,公司,30.57807454,114.3571012,39379,7
4714,中国电信(二七路营业厅),江岸区解放大道2309号,公司,30.63201866,114.3160045,39384,7
4715,中国电信(汉口新后湖大道营业厅),湖北省武汉市江岸区后湖大道152号,公司,30.64693815,114.2867925,39389,7
4716,湖北中移通信技术工程有限公司,惠济路12号,公司,30.6097081,114.2840463,39397,7
4717,湖北省电力公司武汉供电公司-停车场,西马路16号附近,停车场,30.59995451,114.2900235,39399,5
4718,武汉凯源电力工程有限公司,武汉市江岸区丹水池街办事处解放大道2647号,公司,30.65027624,114.3246324,39400,7
4719,湖北汇腾电力建设有限公司,湖北省武汉市江岸区谌家矶红桥集团工业园东北(繁盛街),公司,30.68462272,114.3613429,39401,7
4720,武汉锦能电力工程有限公司,武汉市江岸区竹叶新村110号,公司,30.62829934,114.2802982,39403,7
4721,武汉海吉电力科技发展有限公司,湖北省武汉市江岸区工农兵路,公司,30.62077912,114.2981411,39404,7
4722,源智慧电力工程有限公司,湖北省武汉市江岸区三阳路128号附近,公司,30.60231454,114.2957081,39405,7
4723,湖北鄂能源电力技术工程有限公司,湖北省武汉市江岸区永清街街道解放大道1328号中原大厦21楼湖北鄂能源电力技术工程有限公司,公司,30.60948788,114.2998493,39406,7
4724,湖北省电力公司物流服务中心,胜利街210,公司,30.59816355,114.2997227,39410,7
4725,武汉沃丰电力设备有限公司,汉黄路56号,公司,30.6719338,114.3223179,39411,7
4726,华夏环保卫生管理有限公司,武汉市江岸区东方恒星园4栋402,公司,30.63612023,114.2818154,39415,7
4727,武汉水怡环保科技工程有限公司,武汉市江岸区金桥大道81号a栋811室,公司,30.65429895,114.2881613,39416,7
4728,老乡长(田园食尚店),武汉市江岸区发展大道357号田园商务大厦1楼,中餐,30.6226569,114.2699738,39419,1
4729,亢龙太子酒轩(建设大道店),湖北省武汉市江岸区建设大道711号,中餐,30.59976472,114.2670805,39435,1
4730,武汉竹安工程设备管理有限公司,武汉市江夏区鸿发大市场D9102号,公司,30.38673563,114.4470782,39436,7
4731,武汉鸿诚工程咨询管理有限责任公司,后湖大道21附1,公司,30.63748796,114.266073,39437,7
4732,武汉天虹工程管理咨询有限公司,武汉市江岸区金桥大道凯信大厦3栋1912,公司,30.65671055,114.2887254,39439,7
4733,武汉园发工程建设备管理有限公司,劳动街办事处解放公园路40号,公司,30.6078039,114.2922433,39440,7
4734,中建三局第二建设工程有限责任公司-设备管理公司,江夏区高新流芳大道39号,公司,30.43013778,114.4478905,39446,7
4735,武汉江岸环卫集团有限公司清扫二公司,新村街办事处长湖地六村130号,公司,30.63976422,114.3235581,39448,7
4736,武汉岸七清环卫有限公司,新村街办事处解放大道1942号,公司,30.64176433,114.3231665,39449,7
4737,武汉奥哲利环卫科技有限公司,汉黄路7号环保市场A1栋,公司,30.66413714,114.3263748,39452,7
4738,福林超市,道观河风景旅游管理处道观风景旅游区旅游大道163号,公司,30.87934142,114.9779977,39465,7
4739,天心禅茶居,武汉市江岸区解放公园路42号解放公园内公园管理处旁(近塔林西亲水平台),休闲餐饮,30.61243299,114.2901709,39475,2
4740,武汉航天波纹管理股份有限公司,解放大道2697号,公司,30.65681276,114.3272256,39477,7
4741,湖北威玖国际酒店管理有限公司(徐东店),湖北省武汉市洪山区团结路佳馨花园公务员小区1号楼,公司,30.589117,114.3336286,39480,7
4742,三师兄餐饮管理有限公司,湖北省武汉市江夏区藏龙岛科技园凤凰花园一期,公司,30.44096198,114.419235,39483,7
4743,武汉中保世纪物业管理有限公司,湖北省武汉市江岸区台北街办事处台北路金融花园(鲩子湖旁),公司,30.6006988,114.2776693,39484,7
