NUM,name,address,type,lat,lon,id,label
6710,恒鑫超市,湖北省武汉市东西湖区永兴塑料厂西南90米(金潭路东),便利店,30.67365082,114.2884127,47654,4
6711,武汉俊义祥塑料包装有限公司,花山二路与金龙大街交叉口西南100米,公司,30.37892814,114.3759011,47655,7
6712,世纪华章仓库,惠安大道778号新城十三路硕冠塑料有限公司院内,公司,30.60239895,114.0976538,47656,7
6713,领盛塑料机械(武汉)有限公司,湖北省武汉市蔡甸区旭光村工业园特2号,公司,30.61106437,114.027213,47657,7
6714,金银潭现代企业城,金银潭将军街宏图路,公司,30.67661175,114.2683619,47658,7
6715,武汉安通塑胶有限公司,将军五路5号,公司,30.65830245,114.2593505,47659,7
6716,武汉泽琦塑料机械制品有限公司,旭光村工业园特2号,公司,30.61159706,114.0312625,47660,7
6717,湖北永泰塑胶有限公司,武汉市东西湖区金山大道金海工业园28号,公司,30.63407977,114.1593807,47661,7
6718,中机三勘岩土工程有限公司,塔子湖街街道春兰街89号,公司,30.64417976,114.256198,47663,7
6719,中国电信股份有限公司武汉东西湖区分公司-2号楼,湖北省武汉市东西湖区吴家山(东吴大道),公司,30.62463517,114.1437561,47664,7
6720,陆路通塑胶有限公司,市场西一路与市场西二路交叉口东50米,公司,30.61296368,114.1460271,47666,7
6721,威龙塑胶,湖北省武汉市东西湖区西二路,公司,30.61662183,114.1445976,47668,7
6722,华丰塑胶,武汉市东西湖区,公司,30.68268828,114.2705384,47670,7
6723,亿旺风顺塑胶,湖北省武汉市~口区市场北二路,公司,30.61872571,114.1474564,47672,7
6724,武汉昌盛德食品有限公司,湖北省武汉市东西湖区走马岭街道六合大队,公司,30.61699512,114.0099705,47673,7
6725,叶梓服装有限公司,湖北省武汉市东西湖区将军路街道将军5路5号叶梓服装有限公司,公司,30.65830346,114.2593505,47675,7
6726,武汉华希生态农业股份有限公司,湖北省武汉市黄陂区李家集街道新庙村祁泡线西侧塑料大棚附近,公司,30.99625139,114.2320223,47676,7
6727,湖北延顺木业有限公司,东山头街道东山头办事处华中创新产业园二期B3区25栋-4,公司,30.7944023,114.0307822,47677,7
6728,巴士麦普(武汉)有限公司,武汉市蔡甸区常福工业园光大塑胶5号厂房,公司,30.43387815,114.0456755,47678,7
6729,唐人集团,湖北省武汉市东西湖区革新大道七雄路海峡创业城一期研发楼3楼唐人集团,公司,30.61555637,114.1225415,47680,7
6730,汉塑管业集团,武汉市东西湖区吴家山街道四明路华星花园17栋群楼,公司,30.6128087,114.1420636,47681,7
6731,鸿鑫加工厂,湖北省武汉市东西湖区高桥四路,公司,30.62034626,114.0510296,47683,7
6732,宏杰风管加工厂,湖北省武汉市东西湖区张柏路,公司,30.7026569,114.1355822,47686,7
6733,东西湖服务区-停车场,湖北省武汉市东西湖区新河镇京港澳高速公路东(近东西湖服务区),停车场,30.70307789,114.0352646,47711,5
6734,武汉华成园林绿化有限公司,商贸大道与新径路交叉口南200米,公司,30.65339449,114.0273876,47713,7
6735,武汉西郊园林绿化有限公司,园艺路1,公司,30.63533249,114.1286517,47714,7
6736,武汉东惠园林绿化工程有限公司,武汉市东西湖区慈惠街161号,公司,30.5956169,114.0568027,47715,7
6737,伊帝园林绿化科技公司,湖北省武汉市东西湖区,公司,30.74372328,114.0698438,47716,7
6738,天泽瑞绿色蔬菜专业合作社,湖北省武汉市东西湖区东山街道群力大队,公司,30.73314029,114.0499749,47717,7
6739,湖北木可园林绿化有限公司,径河街塔西路,公司,30.67914956,114.1406718,47718,7
6740,武汉森源绿化工程公司,湖北省武汉市东西湖区吴家山二雅路明珠小区东北,公司,30.62460789,114.1441923,47719,7
6741,武汉锦航园林绿化工程有限公司,武汉市东西湖区惠安大道西50米,公司,30.63455805,113.9974859,47720,7
6742,武汉风土园林绿化有限公司,东西湖大道1818号金山大厦4层,公司,30.62069898,114.1371261,47721,7
6743,北冰洋城市广场,武汉市东西湖区四明路,购物中心,30.6247854,114.1370114,47722,3
6744,武汉母仪天下健康管理有限公司(总部),武汉市东西湖区金银潭现代企业城B2栋15楼A区,公司,30.67792348,114.2690205,47730,7
6745,广东粤能工程管理有限公司,武汉市东西湖区将军路街道金银潭现代企业城b2栋7楼,公司,30.67828339,114.2693426,47731,7
6746,鼎牛餐饮管理有限公司,将军三路19号,公司,30.6535553,114.2566722,47732,7
6747,武汉爱洁物业管理有限公司,湖北省武汉市东西湖区将军街将军四路24号武汉爱洁物业管理有限公司,公司,30.65979357,114.2561595,47733,7
6748,武汉通和顺达物业管理有限公司,将军四路26号,公司,30.66006949,114.2559735,47736,7
6749,武汉微领汇企业管理咨询有限公司,湖北省武汉市东西湖区银潭路武汉客厅G栋1911,公司,30.67371649,114.2751732,47738,7
6750,九州通医药集团物流有限公司,武汉市东西湖区田园大道99号,公司,30.62726823,114.0815183,47740,7
6751,龙鑫集团,湖北省武汉市东西湖区舵落口沙嘴朝阳路112号,公司,30.60379622,114.1493545,47742,7
6752,天黎集团,武汉市东西湖区慈惠办事处万寿宫179号,公司,30.6070919,114.0948943,47744,7
6753,敏实集团,泾河街道金北二路1号,公司,30.66387601,114.1404025,47746,7
6754,凌云科技集团,湖北省武汉市东西湖区金山大道146号,公司,30.63647778,114.1769406,47747,7
6755,中国三江航天工业集团公司,湖北省武汉市东西湖区金银湖路西150米,公司,30.64492982,114.1965301,47748,7
6756,长兴集团,湖北省武汉市东西湖区海口二路1298号,公司,30.64380102,114.1570876,47749,7
6757,金太阳集团,武汉市东西湖区金银潭大道128号,公司,30.67120169,114.2813128,47751,7
6758,湖北福汉木业集团地板分公司,东吴大道37,公司,30.62786708,114.1042027,47752,7
6759,中国移动通信集团湖北有限公司东西湖分公司,湖北省武汉市东西湖区二雅路200,公司,30.63108674,114.1450491,47753,7
6760,百信集团,湖北省武汉市东西湖区临空港大道29号,公司,30.61376983,114.1317885,47756,7
6761,唐人神集团武汉湘大饲料有限公司,武汉市东西湖区吴家山辛安渡张辛路168号,公司,30.74349208,113.9815753,47757,7
6762,湘江电缆集团湖北南远电缆科技有限公司,湖北省武汉市东西湖区油纱路12号,公司,30.6871809,113.9840724,47760,7
6763,武汉市华鑫管道机械,湖北省武汉市东西湖区富民南路,公司,30.62226074,114.0989885,47764,7
6764,亮诚管道(荆州亮诚科技股份有限公司),湖北省武汉市东西湖区西二路舵落口大市场19区13栋5号,公司,30.61090502,114.1456017,47767,7
6765,三惠敏实汽车,湖北省武汉市东西湖区金北二路,公司,30.66493011,114.1390468,47770,7
6766,武汉找劳保网科技有限公司(湖北分公司),惠安大道780号隆腾世纪工业园(联塑管道旁),公司,30.60136995,114.1008916,47771,7
6767,武汉唯特奇管道有限公司,武汉市蔡甸区L山街中原村村委会对面,公司,30.47547241,113.9687603,47775,7
6768,金利通管道疏通(江汉店),洪山广场,公司,30.54803307,114.3315104,47776,7
6769,东西湖建筑工程质量检测中心,湖北省武汉市东西湖区海口二路和新桥二路交叉口,公司,30.64128624,114.1597326,47786,7
6770,武汉孚美汽车自动变速箱技术服务有限公司,湖北省武汉市东西湖区七雄路天地源工业园20栋1单元,公司,30.60817523,114.1222193,47787,7
6771,湖北泰斯达自动变速箱技术服务有限公司,湖北省武汉市东西湖区革新大道167号,公司,30.61729212,114.0970144,47789,7
6772,星驰捷汽车技术服务有限公司,东吴大道38号(航天彩虹镇对面),公司,30.62745259,114.108103,47790,7
6773,武汉一诺承金技术服务有限公司,湖北省武汉市东西湖区吴家山吴中街272号武汉一诺承金技术服务有限公司,公司,30.63146406,114.129985,47791,7
6774,通标标准技术服务有限公司武汉分公司,湖北省武汉市蔡甸区车城南路武汉出口加工区D栋,公司,30.47931425,114.1456947,47792,7
6775,湖北良品铺子良品一号物流基地,湖北省武汉市东西湖区食品三路,公司,30.65356164,114.0014188,47796,7
6776,正广通物流园,湖北省武汉市东西湖区食品三路5号,公司,30.65328871,114.0012545,47797,7
6777,武铁物流(惠安大道店),湖北省武汉市东西湖区惠安大道561号,公司,30.60870037,114.0562756,47798,7
6778,武汉山绿冷链物流公司,湖北省武汉市东西湖区高桥五路18号,公司,30.62369094,114.0594039,47799,7
6779,武汉传化致远公路港物流有限公司,湖北省武汉市东西湖区兴工十三路和食品二路交叉口,公司,30.6354685,114.0172173,47800,7
6780,湖北交运物流,湖北省武汉市东西湖区长青街道革新大道幸福村公交站,公司,30.6201791,114.0686499,47801,7
6781,新博慧保安服务有限公司,武汉市东西湖区,公司,30.64849788,114.2476453,47812,7
6782,武汉玲珑汽车服务公司,湖北省武汉市东西湖区吴家山吴中街文苑花园(海景花园南),公司,30.63126511,114.1443866,47823,7
6783,湖北毅力机械有限公司服务部,工农路6,公司,30.58892959,114.0313971,47825,7
6784,中南工程咨询设计集团(武汉)工程技术研究院有限公司,武昌中南路嘉园大厦1号楼中南国际旅游公司,公司,30.54287902,114.3275727,47826,7
6785,中国电信(翠堤春晓营业厅),金银湖南街6附37号,公司,30.63004152,114.1942217,47923,7
6786,中国移动(东山营业厅),莲湖村240,公司,30.77630307,114.015532,47929,7
6787,中国电信(朱湖营业厅),湖北省孝感市孝南区朱湖水陆派出所(车站路西),公司,30.78607192,113.9385555,47931,7
6788,宅急送湖北分公司(金银潭营业厅),湖北省武汉市东西湖区将军三路6号,公司,30.65276829,114.2574344,47943,7
6789,长青建设集团,武汉市东西湖区金山大道海口电力工业园海口三路3号,公司,30.64030038,114.1600791,47944,7
6790,中国电信(东山营业厅),莲湖村1号,公司,30.77389905,114.0098673,47945,7
6791,国家电网,卫东路与陈东路交叉口东50米,公司,30.77691957,114.016983,47948,7
6792,武汉吉辰速运配送有限公司,武汉市东西湖区海口三路5号,公司,30.6423964,114.1600568,47950,7
6793,三强电力设备安装工程有限公司,环湖中路83,公司,30.67424783,114.2141781,47951,7
6794,武汉市天燃气有限公司,武汉市东西湖区二雅路108,公司,30.62600159,114.1451524,47953,7
6795,武汉零陆燃气有限责任公司,武汉市东西湖区将军三路与张公堤交叉口西北200米,公司,30.65010764,114.2580675,47956,7
6796,武汉市天然气有限公司(南湖花园客服中心),平安路311,公司,30.51461224,114.3139453,47958,7
6797,中国移动(新东棉营业厅),油纱路69,公司,30.68526933,113.9804929,47959,7
6798,武汉中维德远液压机械有限公司,武汉市东西湖区新城十五路与金山大道交叉口,公司,30.63597078,114.0877344,47962,7
6799,博达高压油管,姑李路186号,公司,30.65162047,114.2438726,47965,7
6800,东南液压气动,湖北省武汉市东西湖区华中五金机电第一城(田园街南),公司,30.62326544,114.0991145,47966,7
6801,武汉超高压科技有限公司,湖北省武汉市东西湖区宏图路金银潭现代企业城b7栋武汉超高压科技有限公司,公司,30.67829701,114.2682455,47967,7
6802,河北海皓高压法兰管件有限公司,武汉市东西湖区,公司,30.68218611,114.2706812,47968,7
6803,湖北欣宏达液压气动设备有限公司,湖北省武汉市东西湖区五金南街华中五金机电第一城,公司,30.62152812,114.1000594,47969,7
6804,漯河市福沃液压件厂武汉办事处,湖北省武汉市东西湖区五金南街,公司,30.62126713,114.0995845,47971,7
6805,武汉立新液压气动设备有限公司,武汉市东西湖区新城十二路53-57号现代五金机电城40栋12-14号,公司,30.62171775,114.1015595,47973,7
6806,鑫丙特液压气动,湖北省武汉市东西湖区田园大道102号南70米,公司,30.62322008,114.0998901,47974,7
6807,武汉星兴达液压气动设备有限公司,湖北省武汉市东西湖区现代五金机电城23栋10号,公司,30.62098652,114.0990524,47975,7
6808,武汉前进液压器材有限公司,武汉市东西湖区,公司,30.62546613,114.0771546,47976,7
6809,濮阳市瑞德压力容器有限公司驻武汉办事处,湖北省武汉市东西湖区新城十三路华中五金机电第一城,公司,30.62309757,114.098045,47978,7
6810,新海宏液压油管,湖北省武汉市东西湖区五金南街,公司,30.62083129,114.0962104,47980,7
6811,华德液压气动,湖北省武汉市东西湖区田园大道62号附近,公司,30.62368239,114.0989336,47982,7
6812,湖北益力液压设备有限公司,湖北省武汉市东西湖区东光工业新城,公司,30.70373618,114.1375288,47983,7
6813,品源液压气动有限公司,湖北省武汉市东西湖区吴家山现代五金机电城29栋4号品源液压气动有限公司,公司,30.62161899,114.0988982,47984,7
6814,武汉派力通液压气动设备有限公司,湖北省武汉市东西湖区新城十三路42号,公司,30.62162504,114.0987423,47985,7
6815,攀攀重型液压,湖北省武汉市东西湖区高桥三路,公司,30.62826879,114.0505216,47987,7
6816,森丽液压气动,武汉市东西湖区湖北现代五金机电城8栋22号,公司,30.62322042,114.1002562,47988,7
6817,大通气动液压,武汉市东西湖区湖北现代五金机电城30栋3-4号,公司,30.62113089,114.0990927,47989,7
6818,武汉奥弘液压机电设备有限公司,湖北省武汉市东西湖区现代五金机电城11栋1-4号,公司,30.62230318,114.0999447,47990,7
6819,武汉旭吉泰液压技术有限公司,湖北省武汉市东西湖区田园大道102号南70米,公司,30.62322008,114.0998901,47992,7
6820,恒威液压气动,湖北省武汉市东西湖区田园大道65号附近,公司,30.62427001,114.0985273,47994,7
6821,万利达液压,湖北省武汉市东西湖区新城十二路,公司,30.62132341,114.100721,47995,7
6822,广州恒松工程液压配件部,湖北省武汉市东西湖区新城十三路30号附近,公司,30.62128379,114.0982854,47996,7
6823,武汉奥弘液压机电设备有限公司,湖北省武汉市东西湖区新城十二路115号附近,公司,30.62305839,114.1010988,47997,7
6824,武汉金亿来液压机电设备有限公司,湖北省武汉市东西湖区五金南街华中五金机电第一城,公司,30.6229619,114.0989339,47998,7
6825,星海盛世供暖系统材料,武汉市东西湖区金银潭大道39号,公司,30.66054105,114.2565019,48003,7
6826,武汉广华供暖工程有限公司,东西湖区金潭路团结激光工业园4栋B号,公司,30.67480538,114.2631232,48004,7
6827,中国油联(柏泉加油站),张柏路与茅庙集街东一巷交汇处西,加油站,30.72659336,114.1213485,48005,6
6828,中国电信营业厅,湖北省武汉市东西湖区东吴大道1192号,公司,30.62489589,114.1437072,48009,7
6829,中国电信(金银湖运营基地),金银湖街道金银湖航天路9号中国电信金银湖运营基地电信大楼,公司,30.64886382,114.1950403,48010,7
6830,武汉互邦环境服务有限公司,湖北省武汉市东西湖区祁家山路25号附近,公司,30.62741621,114.1399403,48014,7
6831,湖北五丰石环境工程有限公司,湖北省武汉市东西湖区环湖一路,公司,30.67139805,114.2145338,48015,7
6832,武汉百克环境科技有限公司,湖北省武汉市东西湖区金银潭路武汉客厅a栋2806室武汉百克环境科技,公司,30.67515721,114.2725891,48017,7
6833,百信环境,湖北省武汉市东西湖区五环大道29号,公司,30.61432847,114.1318509,48018,7
6834,武汉奇亚环境工程有限公司,八方路立方城西南200米,公司,30.6186693,114.1214769,48019,7
6835,武汉华航环境工程有限公司,革新大道海峡创业城16层,公司,30.6151308,114.1215393,48020,7
6836,武汉立泰舒适环境设备有限公司,三秀路海林大厦23楼,公司,30.62539705,114.1396866,48021,7
6837,武汉阿米尔环保科技有限公司,湖北省武汉市东西湖区宏图大道武汉客厅C栋2301室,公司,30.67504791,114.2753633,48022,7
6838,古普(湖北)环保新材料有限公司,湖北省武汉市东西湖区融园国际21楼,公司,30.6419978,114.134742,48023,7
6839,武汉长寿村健康环保新材料有限公司,武汉市东西湖区径河路和昌工业园2栋5-6号,公司,30.67514495,114.143173,48024,7
6840,湖北永华环保装饰材料有限公司,湖北省武汉市东西湖区油纱路143-1号,公司,30.68550973,113.9756754,48025,7
6841,武汉高昌环保科技有限公司,径河三路与径河中路交叉口西100米,公司,30.6772904,114.1396996,48026,7
6842,恒鑫环保通风设备,湖北省武汉市东西湖区湖北现代五金机电城8栋10号,公司,30.62322008,114.0998901,48027,7
6843,武汉鑫阳光环保设备有限公司,东西湖大道5649号,公司,30.62051566,114.1000811,48028,7
6844,武汉百信环保能源科技有限公司,湖北省武汉市东西湖区小学侧路与市场街交叉口东北200米,公司,30.70088591,113.9491191,48029,7
6845,武汉鑫淼环保工程有限公司,湖北省武汉市东西湖区舵落口大市场五金家电涂料城10区4楼89号,公司,30.61610116,114.1470551,48030,7
6846,湖北鑫银海环保科技有限公司,湖北省武汉市东西湖区沿海赛洛城1期50栋8号,公司,30.63879809,114.1529402,48031,7
6847,武汉超凡环保设备有限公司,团结街,公司,30.60752656,114.1046738,48032,7
6848,武汉晶彩环保科技有限公司,武汉市东西湖区革新大道海峡创业城5层,公司,30.6151308,114.1215393,48033,7
6849,武汉益恒丰环保科技有限公司,湖北省武汉市东西湖区革新大道亚力水泥制品公司附近,公司,30.61477339,114.103603,48034,7
6850,武汉市格瑞环保汽车用品有限公司,湖北省武汉市东西湖区团结街中小企业城83栋,公司,30.60790834,114.1043934,48035,7
6851,宏运通达环保设备技术公司,将军路230号,公司,30.65582649,114.2597268,48037,7
6852,百信环保能源科技公司,湖北省武汉市东西湖区海峡两岸科技产业管理处新城五路西革新大道南武汉百信集团2号楼,公司,30.61372048,114.1317002,48039,7
6853,武汉熙诚环保科技有限公司,新城十八路8号3栋3A22号,公司,30.62732716,114.0767131,48040,7
6854,武汉三国柒环保科技有限公司,革新大道586号(七雄路交汇处),公司,30.61430379,114.1243435,48041,7
6855,武汉水分子环保科技有限公司,径河街道银柏路51号新光工业园4楼,公司,30.68068255,114.1714024,48042,7
6856,武汉绿水环保科技有限公司,吴北路191号,公司,30.64676668,114.1367588,48043,7
6857,武汉清澄环保科技工程有限公司,三店东路南200米,公司,30.64383039,114.139888,48044,7
6858,国华环保砖公司,径上村31,公司,30.66553758,114.1588152,48045,7
6859,武汉联兴环保科技有限公司,惠安大道803号世纪千华三栋,公司,30.60247133,114.1198573,48047,7
6860,武汉涂典环保材料有限公司,金银湖路9号,公司,30.63405991,114.197861,48048,7
6861,艾特威(武汉)环保科技有限公司,银柏路51号4楼,公司,30.68108187,114.1711175,48049,7
6862,鼎誉科技环保中国,东西湖大道与九支沟交汇处力通达旁,公司,30.61931491,114.1160467,48052,7
6863,锦华环保通风设备安装公司,沁园街101号,公司,30.62523304,114.1255466,48054,7
6864,湖北方圆环保科技有限公司,武汉市光谷大道52号国际企业中心一期伟创楼2楼,公司,30.49174555,114.4145766,48055,7
6865,武汉五一丰收生态农业园,湖北省武汉市东西湖区五四北路,公司,30.73245325,114.021924,48061,7
6866,公共停车场,湖北省武汉市武昌区白鹭街118号,停车场,30.5559524,114.3367837,48063,5
6867,东西湖区城市管理委员会吴中路垃圾分类服务站-停车场,湖北省武汉市东西湖区吴中街322号附近,停车场,30.63115531,114.1322293,48082,5
6868,恒丰市政设施有限公司,武汉市黄陂区前川东寺七组,公司,30.90086813,114.3517588,48083,7
6869,武汉帝豪时尚酒店管理有限公司,一清路竹叶海嘉园10号楼,公司,30.62573596,114.1494006,48087,7
6870,九州通物流,湖北省武汉市东西湖区产业管理处田园大道98号,公司,30.6271966,114.0803601,48088,7
6871,武汉腾飞人才管理咨询有限公司,蔡甸区沌阳路新都国际嘉园A座二楼三楼,公司,30.48882141,114.1504309,48090,7
6872,武汉东西湖绿建项目管理有限公司,湖北省武汉市东西湖区银花街,公司,30.65696187,114.2529995,48094,7
6873,武汉新金彩画王广告有限公司,湖北省武汉市东西湖区产业管理处田园大道广大钢构对面纽兰工业园6栋4楼,公司,30.62261751,114.0897815,48096,7
6874,鸿运九昌,湖北省武汉市东西湖区产业管理处新城十五路与东吴大道交汇处,公司,30.62835128,114.0882675,48097,7
6875,全日(武汉)供应链管理有限公司,湖北省武汉市东西湖区金山南路新岭二路盈石物流园内,公司,30.66752393,114.0300799,48098,7
6876,武汉盛世金帆工程项目管理有限公司,湖北省武汉市东西湖区啤砖路55号,公司,30.65355678,114.1393119,48099,7
6877,武汉中军凯旋供应链管理有限公司,湖北省武汉市东西湖区G316(福兰线),公司,30.64641296,114.0290741,48103,7
6878,湖北易建通供应链管理有限公司,湖北省武汉市东西湖区高桥街,公司,30.63035565,114.0592314,48104,7
6879,上海鲜波隆供应链管理有限公司武汉分公司,湖北省武汉市东西湖区高桥四路185号,公司,30.63629001,114.0595973,48105,7
6880,武汉润邦供应链管理有限公司,湖北省武汉市东西湖区吴家山联盟路9号,公司,30.61681946,114.0623943,48107,7
6881,中盛信通(湖北)供应链管理有限公司,湖北省武汉市东西湖区商贸大道,公司,30.65899094,114.0222018,48111,7
6882,洗衣管理有限公司,湖北省武汉市东西湖区将军路街道金银潭大道135号际华武汉三五零六纺织服装公司厂区内宜洗洗衣管理有限公司,公司,30.67451674,114.2835338,48112,7
6883,湖北战友企业管理集团有限公司,湖北省武汉市东西湖区东西湖大道3765附近,公司,30.65442913,114.0227519,48114,7
6884,湖北中地私厨捞面餐饮管理有限公司,湖北省武汉市东西湖区革新大道,公司,30.63921701,114.0244544,48117,7
6885,武汉健齿医疗管理公司,工农路24号附近,公司,30.61200872,114.1636943,48120,7
6886,汉南区人力资源服务中心,武汉市汉南区薇湖路384号,公司,30.30954587,114.0695729,48122,7
6887,宏元人力资源,武汉市汉南区,公司,30.30173569,114.0555212,48130,7
6888,武汉经济技术开发区公安分局出入境接待室,武汉市东风大道88号,公司,30.50785163,114.1624968,48149,7
6889,路侧停车位(武汉市汉南区水务局南),纱帽正街518号号附近,停车场,30.31622508,114.0698011,48151,5
6890,惠帝餐厅,武汉市汉南区薇湖路383号(税务局对面),中餐,30.30913304,114.070095,48153,1
6891,武汉金诚豪景酒店管理有限公司,武汉市东西湖区东西湖大道金诚国际石材精品中心5-6号(近二十一支沟),公司,30.62754855,114.0608448,48154,7
6892,海景花园建设管理处,湖北省武汉市东西湖区金山大道55号附近,公司,30.63978001,114.1369531,48157,7
6893,武汉欣安居物业管理有限公司(梨花园管理处),湖北省武汉市东西湖区梨花园路14附近,公司,30.62597599,114.1424605,48158,7
6894,将军花园物业管理分公司,湖北省武汉市东西湖区银花街65号北80米,公司,30.65282218,114.2461426,48160,7
6895,新康物业管理有限公司常青花园八区服务中心,公园环路与常青花园中路交叉口北150米,公司,30.64250735,114.23275,48162,7
6896,武汉市东西湖区瑞闽物资,湖北省武汉市东西湖区田园大道,公司,30.62225398,114.1047328,48163,7
6897,惠民物资,湖北省武汉市东西湖区西二路,公司,30.61334473,114.1458654,48164,7
6898,德盛物资,湖北省武汉市东西湖区S40(四环线),公司,30.62232334,114.1047958,48165,7
6899,鑫东盛物资,湖北省武汉市东西湖区S40(四环线),公司,30.62254653,114.1050391,48168,7
6900,立丰物资,武汉市东西湖区产业管理处吴家山十一支沟运通钢材市场b区203-204号,公司,30.62188909,114.1030111,48169,7
6901,锦鹏物资,湖北省武汉市东西湖区S40(四环线),公司,30.62191392,114.1045437,48170,7
6902,武汉飞跃物资,湖北省武汉市东西湖区田园大道,公司,30.622749,114.1049669,48171,7
6903,武汉国有(鑫东康)物资,湖北省武汉市东西湖区田园大道,公司,30.62262469,114.1049759,48172,7
6904,自立物资,湖北省武汉市东西湖区新城十二路,公司,30.6222261,114.1026954,48173,7
6905,双诚保物资,湖北省武汉市东西湖区田园大道,公司,30.62264791,114.1049849,48174,7
6906,武汉市兴煌物资有限公司,湖北省武汉市东西湖区宏图路武汉冰山工业园北350米,公司,30.68322459,114.2725233,48175,7
6907,卓扬物资,湖北省武汉市东西湖区田园大道,公司,30.62219918,114.1047869,48177,7
6908,武汉东方腾龙物资有限公司,武汉市东西湖区,公司,30.68268828,114.2705384,48178,7
6909,武汉市兴亿兆物资有限公司,湖北省武汉市东西湖区广浩钢材经营部(田园街南),公司,30.62213182,114.1036151,48181,7
6910,天超钢材物资,湖北省武汉市东西湖区田园大道117号西南90米,公司,30.6231681,114.1032358,48183,7
