NUM,name,address,type,lat,lon,id,label
2355,福隆寄售行( 武汉市洪山区),湖北省武汉市洪山区和平乡园林场金鹤园小区86栋12号门面,公司,30.61041743,114.3731632,28734,7
2356,武汉市新星电线电缆有限责任公司  上海科锦特种电线电缆有限公司,湖北省武汉市江汉区中山大道716号,公司,30.57648992,114.2815699,28735,7
2357,微型消防站,武汉市黄陂区中百黄陂购物中心武汉市黄陂区黄陂大道387号B1,公司,30.88251802,114.3723115,28736,7
2358,清水源消防站,武汉市洪山区,公司,30.47971981,114.3770094,28738,7
2359,鑫桥消防站,湖北省武汉市东西湖区新桥一路,公司,30.63794631,114.1580327,28739,7
2360,武汉市消防支队江夏郑店消防站,湖北省武汉市江夏区S101(纸金路),公司,30.33556083,114.2922779,28741,7
2361,武汉城市职业学院微型消防站,武汉市洪山区,公司,30.48031627,114.3141818,28744,7
2362,高农生物园微型消防站,湖北省武汉市江夏区神墩二路,公司,30.48439897,114.5370926,28745,7
2363,九全嘉微型消防站,湖北省武汉市江夏区江夏大道,公司,30.36153958,114.3243896,28747,7
2364,大桥新区大花岭村微型消防站,湖北省武汉市江夏区红花路,公司,30.41537252,114.3068507,28754,7
2365,展鹏物业微型消防站,湖北省武汉市江夏区流芳一路,公司,30.44023782,114.4411451,28755,7
2366,花山社区微型消防站,武汉市江夏区,公司,30.36193861,114.3235061,28756,7
2367,未来之光微型消防站,湖北省武汉市洪山区光谷大道3号附近,公司,30.50633311,114.4184697,28759,7
2368,左岭新城社区微型消防站,武汉市洪山区,公司,30.49392386,114.6196889,28765,7
2369,江夏区中医院微型消防站,湖北省武汉市江夏区纸坊大街370附近,公司,30.34572356,114.312725,28770,7
2370,华荣市场微型消防站,湖北省武汉市青山区冶金大道192号南60米,公司,30.62231217,114.4282485,28771,7
2371,盛世阳光酒店微型消防站,湖北省武汉市汉阳区汉阳大道457附近,公司,30.55433809,114.2409118,28779,7
2372,中华路街都府堤社区微型消防站,湖北省武汉市武昌区临江大道63号附近,公司,30.55712684,114.2933287,28782,7
2373,汉正物业管理有限公司微型消防站,汉正街多福小区A栋二单元7楼综合办,公司,30.57085851,114.2703049,28783,7
2374,诺展星座营销中心,湖北省武汉市洪山区铁机路与才汇巷交汇处广埠屯实验小学旁,公司,30.60234263,114.3608496,28790,7
2375,英武消防器材,武汉市汉阳区鹦鹉大道402号,公司,30.53462774,114.2592351,28794,7
2376,龙湖一展空间(发展二路店),湖北省武汉市江汉区江兴路8号,公司,30.62695943,114.2296839,28795,7
2377,周黑鸭(永清街店),武汉市江岸区解放大道1330号(江岸消防大队旁边),中餐,30.60977592,114.299948,28838,1
2378,汉口北企业联合消防队,武汉市黄陂区汉口北大道西100米,公司,30.70781687,114.3164681,28849,7
2379,消防公司,武汉市东西湖区南山市场5栋21,公司,30.62746746,114.1253123,28918,7
2380,消防通道,湖北省武汉市江汉区马场路109号北80米,公司,30.61674246,114.2573402,28920,7
2381,湖北淦德智能消防科技有限公司,临江大道96号万达soho写字楼16层03-04-05号,公司,30.56676044,114.3022639,28921,7
2382,武汉浩普消防灯具,湖北省武汉市~口区顺道街146号-附6、7东南100米,公司,30.57924173,114.2700392,28923,7
2383,武汉市骏腾烟机配件有限责任公司,田园东路与银柏路交叉口西北150米,公司,30.67624101,114.1727116,28945,7
2384,武汉市盛隆特保安服务有限责任公司,湖北省武汉市洪山区武汉市公安局青山区分局(祥丰路北),公司,30.61388176,114.3764796,28948,7
2385,东风创业园鑫丰利工业园微型消防站,湖北省武汉市~口区长丰路4附近,公司,30.61620122,114.1818642,28950,7
2386,二十三街市场微型消防站,湖北省武汉市青山区工业三路35-1号东60米,公司,30.63000714,114.3955645,28956,7
2387,湖北省委党校-停车场,万松园路142附4号附近,停车场,30.59076526,114.2622797,28989,5
2388,湖北今天律师事务所,武汉市武昌区洪山路64号湖光大厦9楼,公司,30.54773934,114.3456615,28992,7
2389,武汉市东西湖东山农场,湖北省武汉市东西湖区东岳村161号,公司,30.7796468,114.0137762,28993,7
2390,武汉源创意设计有限公司,湖北省武汉市江汉区万松街办事处万松园路18号省委党校五楼,公司,30.58881091,114.2623969,28999,7
2391,武汉市比亚迪汽车工业有限公司,武汉市黄陂区天阳路1号,公司,30.76501659,114.2871297,29009,7
2392,元祖食品(水果湖店),武汉市武昌区水果湖街道步行街鹰台商业楼1楼15-16号,中餐,30.54958025,114.3420086,29011,1
2393,武汉双本科技有限公司,武汉市江汉区湖北省委党校写字楼4楼,公司,30.58873923,114.2623443,29015,7
2394,武汉市东瑞汽车销售服务有限公司,武汉市洪山区青菱街红霞村白沙洲大道9号,公司,30.42700182,114.2534522,29018,7
2395,公安牛肉鱼杂（省委店）,武汉市武昌区水果湖路69-3号省直机关三食堂门面(近水果湖路),中餐,30.54906337,114.3420429,29026,1
2396,中国湖北省委湖北省人民政府文印中心,东一路12,公司,30.54610801,114.3378184,29029,7
2397,健利隆电子有限公司,湖北省武汉市江汉区万松园路18号党校函授学院3楼,公司,30.58886893,114.2624279,29040,7
2398,武汉汇力投资,湖北省武汉市蔡甸区花园湾一街56,公司,30.47756325,114.0389126,29049,7
2399,武汉武邦电子科技集团,湖北省武汉市蔡甸区常福工业示范园管理委员会常福新城14号,公司,30.44696653,114.0570112,29063,7
2400,武汉福康行车业有限公司,武汉市蔡甸区常福工业示范园管理委员会常福工业园常禄大道(宏达物流旁),公司,30.43713128,114.0501521,29069,7
2401,武汉市银宝山新模塑科技有限公司,常福工业示范园管理委员会福吉路1号(东昊汽车内),公司,30.43039732,114.0482304,29080,7
2402,武汉宝普科技发展有限公司,武汉市蔡甸区常福工业示范园管理委员会武汉市常福工业示范园管理委员会常福商务广场九康路九康大桥桥头,公司,30.45558181,114.0416285,29093,7
2403,武汉浦大电缆有限公司,湖北省武汉市蔡甸区土桐L山街三店村村民委员会,公司,30.39740123,114.0104506,29094,7
2404,中玻蓝星玻璃厂,湖北省武汉市汉南区中共湘口街非公有制企业联合支部委员会,公司,30.271736,113.8404118,29096,7
2405,中国石化(湖北武汉千湖加油站),湖北省武汉市蔡甸区318国道与干洪路交叉处株儒街道委员会东北,加油站,30.44541042,113.8564492,29101,6
2406,武汉市合力瑞祥商贸公司,湖北省武汉市江夏区金龙大街郑店街合力村村民委员会,公司,30.37731435,114.2269023,29106,7
2407,武汉萱裕机械有限公司,武汉市蔡甸区武汉常福工业示范园管理委员会常福工业园15号地(超凡家具内),公司,30.44632794,114.0411787,29107,7
2408,武汉邦益科技有限公司,武汉市蔡甸区常福工业示范园管理委员会武汉经济技术开发区常福新区常兴路必大工业园5-1,公司,30.44189392,114.0419208,29108,7
2409,武汉华铄金属制品有限公司,湖北省武汉市蔡甸区常福工业示范园管理委员会常福工业园15号,公司,30.44321517,114.0425286,29109,7
2410,武汉今人工贸科技有限公司,湖北省武汉市蔡甸区土桐L山街新集村村民委员会,公司,30.40085999,113.9877893,29110,7
2411,武汉丰通工贸有限公司,武汉市蔡甸区常福大街与九康大道交汇处常福工业示范园管理委员会常福必大工业园2-1号,公司,30.44188986,114.0432832,29111,7
2412,武汉佳鑫成汽车零部件公司,湖北省武汉市蔡甸区常福工业示范园管理委员会常福工业园15号,公司,30.44571566,114.0378976,29112,7
2413,武汉三东汽车零部件有限公司,湖北省武汉市蔡甸区常福工业示范园管理委员会常福工业园常禄大道,公司,30.43811526,114.0501767,29113,7
2414,武汉市张湾扣件厂,湖北省武汉市蔡甸区张湾街道蔡张张湾医院西南350米,公司,30.64948573,113.9636464,29138,7
2415,武汉市美涛种植专业合作社,湖北省武汉市新洲区宋寨村X402(柳明线),公司,30.94050414,114.8305443,29141,7
2416,武汉市维维产业园,湖北省武汉市蔡甸区,公司,30.36800914,113.8608721,29145,7
2417,武汉市青坪防水材料厂,湖北省武汉市江夏区段岭庙街满天星幼儿园东400米,公司,30.27463349,114.2788653,29146,7
2418,武汉市强民农产品专业合作社,武汉市汉南区103省道南庄村村委会附近,公司,30.30752268,113.9779767,29148,7
2419,武汉市如意食品厂,武汉市新洲区,公司,30.76577999,114.6037206,29149,7
2420,武汉市太平方种植专业合作社,武汉市江夏区,公司,30.07888908,114.3232302,29152,7
2421,武汉市湘口棉花,湘口街沿堤路99号,公司,30.27083566,113.8381184,29153,7
2422,武汉市陶博制造有限公司,江夏区乌段路武汉市泽源新型墙体材料有限公司西北侧70米,公司,30.26905658,114.2887718,29155,7
2423,武汉市汉正塑胶厂,湖北省武汉市黄陂区汉正塑胶厂(博士街东),公司,30.79270247,114.286506,29156,7
2424,武汉市富鑫制衣厂,瑞达苑附近,公司,30.78716976,114.6117514,29157,7
2425,武汉市鳜鱼产业园,湖北省武汉市汉南区五支沟西路湖北楚湘生态观光园,公司,30.22550791,113.8213022,29158,7
2426,武汉市七仙湖生态农业有限公司,武汉市新洲区,公司,30.61610174,114.6527983,29160,7
2427,武汉市新麻红棉业有限公司,湖北省武汉市新洲区同心路与106国道交叉口西北150米,公司,30.99682523,114.7526576,29161,7
2428,武汉市杨山义兵茶叶有限公司,武汉市新洲区杨家山村附近,公司,30.86011207,114.9677285,29162,7
2429,武汉市平安益农种植专业合作社,武汉市蔡甸区侏儒山街道武汉市军营村委会军营村村委会附近,公司,30.43932385,113.881652,29163,7
2430,武汉市森发伟业实业有限公司,六房村1栋第1层,公司,30.7167863,114.6235103,29165,7
2431,武汉市重光华荣生态有限公司,武汉市黄陂区祁家湾街重光村特一号,公司,30.93408031,114.2089493,29166,7
2432,武汉市石寨祥盛劳务有限公司,旅游大道194号附近,公司,30.87934083,114.9756498,29167,7
2433,武汉市(徐古)周湾蘑菇科技示范园,吕兴岗附近,公司,30.93469313,114.9770453,29169,7
2434,武汉市洪稷粮油贸易有限公司,洪林路1,公司,30.39083361,113.8512941,29170,7
2435,武汉市小宛葡萄有限公司,江夏区郑店街劳七村,公司,30.29459137,114.2723529,29171,7
2436,武汉市江夏平建建筑工程有限公司,湖北省武汉市江夏区山坡街道京港澳高速公路曙光村村委会,公司,30.07174413,114.2869345,29173,7
2437,武汉市鸿吉农资经营有限公司,洪林路1,公司,30.39081571,113.8513352,29174,7
2438,武汉市火凤凰金属结构有限公司,凤亭大道西50米,公司,30.93531091,114.7539432,29176,7
2439,武汉市顺德昌锌钢护栏有限公司,湖北省武汉市新洲区辛冲正街武汉市辛冲镇委附近,公司,30.77380317,114.8118749,29202,7
2440,武汉市斌华农产品专业合作社,振兴街与王家岭路交叉口西50米,公司,30.30601916,113.9799578,29208,7
2441,武汉市鑫禾包装纸品有限公司,青菱乡长征工业园北关村009号,公司,30.48595221,114.2603424,29209,7
2442,中国石化(武汉市西河加油站),湖北省武汉市蔡甸区G318(沪聂线),加油站,30.41369589,113.7153138,29216,6
2443,武汉市紫云庄葡萄园,湖北省武汉市蔡甸区洪北农业示范区,公司,30.39439606,113.8376266,29222,7
2444,武汉市奥宝利科技有限公司,湖北省武汉市蔡甸区L山街道常福大道L山中学西200米,公司,30.44471434,113.9943181,29224,7
2445,武汉市陈家湾种养殖专业合作社,湖北省武汉市江夏区陈家湾17号,公司,30.06137622,114.4982873,29225,7
2446,武汉槐洋砖瓦制造有限公司,湖北省武汉市汉南区纱帽街道长江村,公司,30.23323514,114.0477132,29226,7
2447,武汉市诚誉棉业有限公司,湖北省武汉市蔡甸区侏儒街道五姓口村,公司,30.4199794,113.7888928,29232,7
2448,武汉市国有银莲湖农场,晨曦路53,公司,30.26483441,113.8478057,29234,7
2449,武汉银翔,湖北省武汉市蔡甸区318国道北100米南屏大厦,公司,30.44011047,113.8063014,29236,7
2450,武汉银港畜牧有限公司,湖北省武汉市汉南区湘口街道向新,公司,30.22906552,113.8472571,29238,7
2451,威威超市,湖北省武汉市汉南区邓南街道洪康路水洪小学东北100米,便利店,30.24976152,113.8685169,29246,4
2452,停车场(武汉市人大常委会西北),武汉市江岸区沿江大道193号附近,停车场,30.60021803,114.3018998,29269,5
2453,市人大机关劳动服务公司,西马街办事处高雄路153号,公司,30.60442666,114.2796119,29281,7
2454,武汉市武昌区艳辉图文广告经营部,首义路街办事处首义路40号(民主党派大楼对面),公司,30.54087445,114.3040658,29380,7
2455,武汉永安旅游有限公司,湖北省武汉市首义路60号,公司,30.5402616,114.3039304,29389,7
2456,一家香花溪牛肉粉店(万松园店),湖北省武汉市江汉区万松园路16号,中餐,30.58456574,114.2636649,29391,1
2457,中楚物业公司,首义路71号湖北民主党派大楼1层,公司,30.54080834,114.3043511,29394,7
2458,桃山村-停车场,武汉市武昌区水果湖洪山路62号(省政协委员会旁)桃山村,停车场,30.54736992,114.3446547,29402,5
2459,武汉中盈恒昌融资担保有限公司,湖北省武汉市武昌区洪山路64号湖光大厦二楼(省政协对面),公司,30.54797145,114.3458468,29404,7
2460,停车场(蔡甸区政协西南),湖北省武汉市蔡甸区政协(新福路南),停车场,30.58034045,114.0235858,29405,5
2461,停车场(武汉市政协西南),沿江大道241-1号附近,停车场,30.60863746,114.3077121,29419,5
2462,深圳市宇美明科技有限公司,湖北省武汉市黄陂区活鲜休闲山庄(黄土公路东),公司,30.99299797,114.3362427,29438,7
2463,金世诺商贸有限公司,武汉市江岸区永清街芦沟桥路1号怡景花园3单元403室轻轨黄浦路站和武汉政协附近武汉天地对面,公司,30.61005208,114.3053244,29469,7
2464,武汉市江夏区流芳粮油贸易公司,武汉市江夏区流芳镇人民政府附近,公司,30.44931647,114.4468861,29516,7
2465,中国石油(马法路),湖北省武汉市江夏区京珠高速与009乡道交叉口安山镇政府附近,加油站,30.15610646,114.2718615,29530,6
2466,江夏区司法局流芳法律事务所,湖北省武汉市江夏区流芳镇人民政府附近,公司,30.44940788,114.4469661,29542,7
2467,唐记花圈寿衣店,湖北省武汉市蔡甸区玉贤镇玉贤路(武汉市玉贤镇政府西北),公司,30.52407833,113.9795908,29543,7
2468,武汉市委印刷厂,汉口惠济路39号,公司,30.6141498,114.2869732,29588,7
2469,农家小院(杨汊湖店),湖北省武汉市江汉区新湾五路152号杨汊湖小区市委党校旁(近市委党校601终点站),中餐,30.63295647,114.2490184,29592,1
2470,韩胖子牛肉粉面(杨汊湖店),常青五路新湾五路167号(杨汊湖市委党校对面),中餐,30.6311688,114.2491546,29599,1
2471,万顺汽车修理厂,香江路5号,公司,30.60754513,114.2731678,29601,7
2472,武汉市万均河砂开采有限公司,武汉市黄陂区043县道西50米,公司,30.9556615,114.4290263,29637,7
2473,樱草生活超市(后湖店),湖北省武汉市江岸区后湖大道105附258号,便利店,30.65468285,114.2988619,29640,4
2474,宣恩县皇贡茶业有限公司,湖北省武汉市武昌区洪山侧路11-附5,公司,30.54463655,114.3393617,29645,7
2475,K11  Select,湖北省武汉市洪山区关山大道355号,购物中心,30.49577189,114.4066038,29742,3
2476,武汉市蔡甸区永安交通管理站,湖北省武汉市蔡甸区安泰街高紫山文体广场附近(永安新城北),公司,30.46084793,113.9368468,29754,7
2477,人民汽车城(武汉)营销中心,湖北省武汉市蔡甸区常福工业园北环路,公司,30.45002787,114.0492702,29777,7
2478,武汉市江夏区公路管理局机务队,段岭庙街附近,公司,30.28795036,114.269076,29812,7
2479,武汉红叶停车场,湖北省武汉市汉南区农垦街,停车场,30.32768098,114.0774602,29889,5
2480,武汉华中国土科技有限公司,湖北省武汉市洪山区文治街17号,公司,30.50377693,114.3332343,29924,7
2481,武汉市国土资源和规划局停车场,三阳路13号,停车场,30.59936647,114.299353,29937,5
2482,湖北初阳生态发展有限公司,湖北省武汉市江夏区土地堂东61号,公司,30.20844183,114.3204292,29950,7
2483,国土规划局-地下停车场,湖北省武汉市江夏区文化大道中百广场,停车场,30.36689185,114.3167871,29953,5
2484,国土规划局-停车场,弘志街与文华路交叉口北150米,停车场,30.36801469,114.3167361,29956,5
2485,中国长城资产管理公司,湖北省武汉市武昌区东湖风景区街道(武昌)东湖路155号,公司,30.56395184,114.3565832,29971,7
2486,管网公司,武汉市东西湖区环湖中路89号汉西污水处理公司三楼,公司,30.66853135,114.223597,29974,7
2487,新华资产管理公司,湖北省武汉市发展大道33号,公司,30.60987654,114.2331473,29976,7
2488,土苗风情特色菜(珞瑜路店),武汉市洪山区珞瑜路718号709,中餐,30.51023633,114.3880419,29980,1
2489,土锅老灶(东西湖店),武汉市东西湖区吴兴南村154号,中餐,30.62688834,114.1391249,29981,1
2490,中真司法鉴定所,湖北省武汉市江汉区汉口万松园路1号创世纪广场,公司,30.58356261,114.2623771,29998,7
2491,湖北诚信司法鉴定所,湖北省武汉市江岸区工农兵路15号中国人民解放军第四五七医院门诊部10楼,公司,30.62351931,114.3008267,30036,7
2492,湖北东湖司法鉴定所,武汉市东西湖区东吴大道632号,公司,30.6278646,114.1215363,30043,7
2493,华医大司法鉴定所武汉服务区,武汉市武昌区和平大道1134-1136号,公司,30.60802011,114.345182,30054,7
2494,四季鲜鱼村,"振兴三路常文里17栋(复兴社区居委会,知心门诊旁)",中餐,30.60736758,114.2389635,30174,1
2495,停车场(中共沌口街工作委员会东),设计院路28号附近,停车场,30.49240572,114.1545969,30211,5
2496,停车场(中共蔡甸街工作委员会东南),武汉市蔡甸区安全巷与汉阳大街交叉口东北50米,停车场,30.58024505,114.0288678,30220,5
2497,江夏区政府金口街道办事处肖山公墓,武赤线附近,公司,30.3394501,114.1347816,30332,7
2498,湖北瑞丰嘉禾农业发展有限公司,湖北省武汉市江夏区金口街道办事处康家垄,公司,30.33413889,114.159832,30337,7
2499,湖北吉隆宏泰木业有限公司,武汉市蔡甸区前进村玉贤街道办事处,公司,30.53229825,113.9679122,30340,7
2500,停车场,湖北省武汉市江夏区金口街道办东北(金湖路),停车场,30.33331614,114.1302922,30342,5
2501,武汉仕兵物流有限公司,沌口街办事处滨湖西路1号,公司,30.48428875,114.1908353,30351,7
2502,华运达库,蔡甸经济开发区沌口办事处武汉市经济技术开发区东荆河路万家湖c区斜对面,公司,30.45925997,114.1674997,30356,7
2503,武汉秉信环保包装有限公司,湖北省武汉市蔡甸区沌口街办事处经济技术开发区新华路8号,公司,30.47795282,114.1574683,30357,7
2504,武汉洛特福动力技术有限公司,武汉市蔡甸区经济开发区沌口办事处珠山湖大道230号奥福多工业园,公司,30.46433845,114.1246333,30362,7
2505,武汉恒精电热设备公司,武汉市蔡甸区蔡甸经济开发区沌口办事处沌口经济开发区枫树南路88号,公司,30.44890724,114.1148609,30363,7
2506,武汉海尔热水器有限公司,武汉市蔡甸区蔡甸经济开发区沌口办事处沌口街办事处东荆河路18号,公司,30.46306451,114.1399562,30364,7
2507,华泰植物油(武汉)有限公司,蔡甸经济开发区沌口办事处武汉经济技术开发区东风大道480号,公司,30.47261766,114.1264225,30366,7
2508,科力光电武汉办事处,武汉市经济技术开发区水木清华59-3-601,公司,30.51305067,114.1465045,30369,7
2509,三环电器有限公司,湖北省武汉市蔡甸区沌口街街道沌口街办事处沌阳大厦371号三环电器有限公司,公司,30.49130389,114.1538162,30370,7
2510,东风亚普汽车部件有限公司,沌口街办事处经济技术开发区车城大道242号,公司,30.48350214,114.1529572,30374,7
2511,钟联管业武汉办事处,湖北省武汉市东西湖区南一路,公司,30.61273937,114.1519984,30375,7
2512,湖北鄂行通物流武汉办事处,湖北省武汉市蔡甸区沌口新街57号,公司,30.46014489,114.181361,30377,7
2513,武汉青顺物流有限公司(东荆河路),沌口街办事处沌口经济开发区东荆河路,公司,30.45805822,114.1567653,30379,7
2514,中车物流武汉办事处,湖北省武汉市蔡甸区沌阳大道306号,公司,30.48146526,114.1812623,30380,7
2515,国家电网(武汉市蔡甸区财政局开发区办事处东南),湖北省武汉市蔡甸区G318(白鹤泉东街),公司,30.45285806,114.0481944,30383,7
2516,武汉市鸿泽汽车运输有限公司办事处,同心路48号附近,公司,30.57951434,114.032327,30387,7
2517,武汉市南北物流股份有限公司,武汉市蔡甸区沌口街办事处沌口开发区东荆河路申云物流对面武汉正能量工业园四环桥下,公司,30.45584577,114.1435648,30389,7
2518,可口可乐(蔡甸办事处),湖北省武汉市蔡甸区博奇路11号丽水新城28栋,公司,30.58204386,114.037756,30391,7
2519,万家乐专柜,唐家墩街街道唐家墩街办事处新华下路281号工贸家电唐家墩店1楼,便利店,30.61862808,114.2656952,30398,4
2520,武汉市社区服务中心,高雄路105武汉慈善城14层,公司,30.60240233,114.28082,30430,7
2521,绿色巨农(法泗)养猪服务中心,湖北省武汉市江夏区法泗街道大路村马法路怡山湾社区,公司,30.15979574,114.1712914,30459,7
2522,武汉市金曦蔬菜专业合作社,武汉市蔡甸区侏洪路127号,公司,30.39835515,113.8524144,30464,7
2523,武汉市节节高物业服务有限公司,湖北省武汉市蔡甸区白鹤泉东街L山街政务服务中心,公司,30.4492041,114.0127994,30465,7
2524,汉南区生猪配种服务中心湘口授精站,康泰路湘口客运站附近,公司,30.26157217,113.8491645,30466,7
2525,等你喜糖,湖北省武汉市江夏区纸坊街社区卫生服务中心北(古驿道),公司,30.35664237,114.3144935,30470,7
2526,国家电网湖北省电力公司武汉供电公司,湖北省武汉市江岸区球场街办事处解放大道1529号,公司,30.59901058,114.2885718,30486,7
2527,国网武汉市东西湖区供电公司,湖北省武汉市东西湖区东吴大道1190号,公司,30.62494921,114.1428182,30488,7
2528,武汉汉阳造国家广告产业园,湖北省武汉市汉阳区龟北路1号,公司,30.55839856,114.262704,30489,7
2529,国家级武汉新材料科技企业孵化器,湖北省武汉市~口区古田五路17号,公司,30.59341672,114.2140723,30491,7
2530,后官湖国家湿地公园-停车场,五贤路西50米,停车场,30.55135802,114.0613027,30493,5
2531,国家电网(武汉车站供电营业厅),湖北省武汉市江岸区天声街26-2号,公司,30.59653986,114.2930337,30498,7
2532,国家电网(~口营业所),武汉市~口区解放大道270号,公司,30.57889464,114.227415,30499,7
2533,冰翡翠茶餐厅(徐东大街店),武汉市洪山区徐东大街111号,休闲餐饮,30.58419821,114.3499532,30501,2
2534,国家电网,湖北省武汉市江汉区雪松路58号,公司,30.59510826,114.263882,30502,7
2535,国家电网(建设大道),永清街办事处罗家庄136号,公司,30.62616091,114.2981318,30512,7
2536,国家电网(水洪供电营业厅),湖北省武汉市汉南区邓南街道湘隆路湘口工业园附近,公司,30.25715823,113.8547946,30515,7
2537,国家电网,车城西路北50米,公司,30.5041516,114.1516799,30517,7
2538,国家电网,武汉市江夏区金湖大道50号,公司,30.33555612,114.1305655,30520,7
2539,国家电网(纸坊供电营业厅),武汉市江夏区纸交巷14号,公司,30.3461101,114.3035243,30521,7
2540,国家科技企业孵化器,湖北省武汉市武昌区徐东二路2号,公司,30.58452016,114.3382069,30523,7
2541,洪山国家科技企业孵化器,南湖大道53号,公司,30.48540694,114.3263623,30524,7
2542,国家电网(纸坊大街),武汉市江夏区纸坊大街605-1-10211,公司,30.34558888,114.3244771,30526,7
2543,国家电网(供电便民服务点),武汉市蔡甸区,公司,30.55090491,114.1187431,30533,7
2544,武汉国家粮食质量监测站,江汉一路9号粮食大厦,公司,30.5827177,114.2832602,30540,7
2545,国家技术转移,武汉市江汉区发展大道164号武汉科技大厦14层,公司,30.61446921,114.2448791,30544,7
2546,国家电网,车城大道282号附近,公司,30.48816256,114.1500502,30546,7
2547,国家电网,东风路与惠安大道交叉口西南100米,公司,30.74129033,113.9279216,30548,7
2548,湖北省人民医院停车场,武汉市武昌区张之洞路95号湖北省人民医院,停车场,30.53855313,114.2941067,30573,5
2549,省检察院-停车场,湖北省武汉市洪山区珞南街道安康路南湖景苑北,停车场,30.50993885,114.3495264,30640,5
2550,人民检察院停车场,武汉市~口区长安路17号,停车场,30.60363968,114.2078269,30654,5
2551,武汉市洪山区人民检察院-停车场,珞喻东路884号附近,停车场,30.50901843,114.4103468,30661,5
2552,检察院宿舍-停车场,湖北省武汉市黄陂区百锦街192号东100米,停车场,30.88430043,114.3736629,30677,5
